title,title_id,genre,authors,weekdays,length,subscribers,views,likes,status,synopsis,rating,year
My Love Affair,3704,ROMANCE,"KING Productions, Nunik & Kaari",SUNDAY,Short,24103,547357,37517,COMPLETED,Jane menyukai seorang pria yang bekerja di sebuah toko buku bernama Davin. Dia bahkan hingga kerja di sana demi dekat dengannya dan ingin menjadi pacarnya. Tapi.. ternyata Davin sudah memiliki pacar! Apa Jane akan tetap ingin menjalin hubungan ini...? ,5,2021
Celebrity Roommate,3703,ROMANCE,"Tae Soyoung, LEE SEO HEE",SATURDAY,Short,665296,49072434,3378706,COMPLETED,"Cha Eunmyeong meninggalkan rumah setelah berhadapan dengan ibu tirinya.
Akhirnya, Eunmyeong tidak punya pilihan lain selain tinggal di rumah kakak Huiyeong, sahabatnya, yang telah dikosongkan sementara waktu.

Tapi ternyata... kakak Huiyeong kembali ke rumah tanpa pemberitahuan?! Terlebih lagi dia adalah Je Junyeong si artis top Korea?!
",5,2021
Dilarang Pacaran!,3702,ROMANCE,"Na young, HJ",THURSDAY,Short,72962,1820455,176867,COMPLETED,"Di sekolah ini, ga boleh ada yang pacaran!!!",5,2021
Murim RPG Simulation,3701,FANTASY,"Hyung Geun Cho, Kwang Hwi",MONDAY,Medium,150380,9826954,677958,HIATUS,"Sebuah window pilihan muncul di depan matamu, tanpa mengetahui masa depan yang akan terjadi. Di dunia di mana hidup dan mati di tanganmu, kita tentunya akan mencari jalan yang terbaik. Kau siap membuat pilihanmu?",5,2021
Pacarku Pemain Sinetron,3700,ROMANCE,"Tania Kyo, KING Productions",SUNDAY,Short,13706,290026,31388,COMPLETED,"Janet, teman dekat dan sekantor yang kusukai ini ternyata pemain sinetron! Kalau dia jadi pacarku.. apa kisah cintaku juga akan seperti sinetron?!",5,2021
Our Beloved Summer,3699,ROMANCE,kyoungchal han,SATURDAY,Short,311639,7750744,947430,COMPLETED,"Yeonsu si ranking satu menjadi tokoh utama dalam film dokumenter soal anak SMA di Korea dengan Woong si ranking terakhir. Sifat mereka yang bertentangan langsung menimbulkan ketegangan di antara mereka. Tetapi, seiring berjalannya waktu, mereka mulai menemukan sisi lain yang tidak diduga dan membuat momen yang mereka lalui jadi tak terlupakan.",5,2021
Kompor,3698,SLICE OF LIFE,Various Artists,"MONDAY, TUESDAY, WEDNESDAY, THURSDAY, FRIDAY, SATURDAY, SUNDAY",Short,125472,5941921,757230,COMPLETED,"Kisah-kisah dari para Author Webtoon, penuh dengan keluh-kesah, penghianatan atau bahkan pelakor.
Amarah di kompilasi kali ini sangat panas... sepanas di kompor!!",5,2021
"Sera, I'm Sorry: Welcome to Our Galaxy",3668,ROMANCE,"MiTi, GuGu",TUESDAY,Short,85026,1258739,158308,COMPLETED,"Tidak ada yang sakit... Tidak ada yang terluka...
Bagaimana kalau kita bisa hidup seperti mahasiswa biasa di suatu dunia baru?
Dan apa yang akan terjadi jika Sera dan Hyocan bertemu lagi di dunia tersebut?! Inilah kisah kocak para mahasiswa yang terungkap kembali!",5,2021
So You,3625,THRILLER,HAN,SATURDAY,Short,72949,3467735,317541,COMPLETED,Drama thriller yang menegangkan! Cinta Yeosin kepada suaminya begitu besar sehingga dia menjadi selalu curiga dan ketakutan kehilangan sang suami. Ini membuat Yeosin menjadi seorang wanita berbahaya yang super posesif dan rela melaklukan apapun untuk mempertahaknkan suami di sisinya. Apakah cinta mereka akan bertahan atau Yeosin harus menghadapi kenyataan pahit?,5,2021
What a Boss Wants,3624,ROMANCE,"silver ring, cotton candy, chicc",FRIDAY,Short,252200,12129266,872306,COMPLETED,"Kwon Dohyuk, seorang pria dengan penampilan, kekayaan, kemampuan, dan pesona yang mematikan. Tapi kenapa tiba-tiba dia mendekatiku?! Kalau begini terus, lama kelamaan identitas yang selama ini aku rahasiakan bisa ketahuan!",5,2021
Yuri's Palace,3623,ROMANTIC FANTASY,"Dawoo, Hill, HAEWON, Cinna",THURSDAY,Short,74963,2462878,290449,COMPLETED,"Yuri yang menjadi putri mahkota terbuang, akhirnya naik menjadi kaisar wanita di Kekaisaran Woo. Di mana hanya wanita yang bisa menjadi Kaisar dan Raja. 
Namun untuk mempertahankan kekuasaannya, satu permaisuri pria tidak cukup. Apalagi jika permaisuri itu justru ingin menjadi Kaisar. Yuri pun akhirnya mencari selir pria baru?!",5,2021
"Like Mother, Like Daughter",3622,THRILLER,YIDAHM,WEDNESDAY,Long,489496,39193571,4355019,ONGOING,"""Aku rasa ibuku adalah seorang pembunuh...""
Relasi mengerikan antara ibu yang perfeksionis dengan anak yang sangat curiga dengan hal hal di sekitarnya!
",5,2021
She Wants You,3621,HORROR,ANZU,TUESDAY,Short,90254,1805684,180096,COMPLETED,"Hari itu aku bertemu dua gadis dari masa lalu, Irena yang misterius dan satu lagi, cewek dari alam lain!
Apa yang sebetulnya terjadi?!
Apa kehadiran mereka ada kaitannya dengan ingatanku yang hilang 4 tahun lalu?
",5,2021
Marry My Idol,3620,ROMANCE,Alonelymeow,SUNDAY,Short,38843,1125509,96189,COMPLETED,"Lova, seorang Fangirl yang merasa dirinya mendapat kesempatan untuk mendekati Idola tercintanya, namun ternyata ada rahasia dibalik sahabat dan sang idola.",5,2021
The Lone Necromancer,3619,FANTASY,"KIM KYOUNG-YEOL, KIM DONG-JUN, JJJ",SATURDAY,Long,160199,10549496,873865,HIATUS,"Pekerjaan apa yang akan kau pilih untuk bertahan hidup saat dunia hancur oleh monster-monster yang tiba-tiba bermunculan?!
Setelah memilih 'Necromancer' sebagai pekerjaannnya, Sungwoo dapat menjadikan monster yang telah ia kalahkan menjadi pengikutnya!",5,2021
The King and the Paladin,3618,ROMANTIC FANTASY,"Irinbi, Park Ji-Eun",FRIDAY,Short,115098,2826753,212645,COMPLETED,"Calliope, seorang putri raja yang berani menakhlukkan kerajaannya sendiri demi menjadi raja dan menikah dengan orang yang dia sukai?! Cinta seorang raja perempuan dan paladin yang dulu dicintainya. 
",5,2021
Hellbound,3617,THRILLER,"Choi Gyuseok, Yeon Sangho",THURSDAY,Short,89778,2589985,186603,COMPLETED,"Sebuah fenomena supranatural yang terjadi di sekitar umat manusia, dan tidak ada yang tahu apakah ini sebuah keajaiban atau kutukan. Inilah Neraka yang diciptakan oleh para orang yang tidak dapat berkabung dengan realita mengenaskan. Direktur ""Train to Busan"", Yeon Sang-ho dan Webtoonist Choi Gyu-Seok, bertemu!",5,2021
The Fox Club,3616,DRAMA,HJ.Hwang,WEDNESDAY,Long,325576,24047319,3034132,HIATUS,"Cherry Shin, seorang cewek sempurna yang tiba-tiba datang ke kehidupan Onyu Park yang biasa saja dan menjadi sahabat akrab. Namun saat keduanya memasuki SMA, mereka berhadapan dengan klub idola rubah SMA Sangmok yang diidolakan seluruh siswa! Kisah drama pertemanan remaja perempuan yang mendebarkan!",5,2021
Phone Addict,3615,ROMANCE,HD,MONDAY,Short,320901,12599591,1686923,COMPLETED,Handphone tua milik Joo Damu tiba-tiba jadi manusia?! Bagaimana Joo Damu menjalani kesehariannya mulai sekarang?!,5,2021
"Date First, Love Later",3614,ROMANCE,"the gom, Jungmi, BABABA",SATURDAY,Short,265648,15328436,1298021,COMPLETED,Gaeun yang dikejar-kejar orang yang tidak dia sukai dan Jaerim yang tertimpa rumor aneh tentang hubungannya. Keduanya butuh mencari jalan keluar dari masalah mereka. Bagaimana kalau mereka pura-pura pacaran saja?!,5,2021
Last Time Love,3613,ROMANCE,Tirapuw,THURSDAY,Short,38667,679020,67429,COMPLETED,Ini adalah kisah tentang seorang makhluk yang mencintai seorang manusia biasa. Namun kisahnya ditentang oleh semesta.,5,2021
Beauty in a Click,3612,ROMANCE,Ryoung,WEDNESDAY,Short,928206,78110135,7061329,COMPLETED,"Seorang Iblis muncul didepanku yang menderita karena aku memiliki penampilan yang buruk! Apakah mungkin aku  bisa menjadi orang yang cantik dengan satu klik? CUTE, SEXY, PURE, DAN LUXURY! Aku bisa berubah jadi apapun! Kupikir aku akan senang, tapi... ternyata bukan begitu ya...?",5,2021
ONE+one,3611,ROMANCE,bubu,TUESDAY,Short,129586,10175666,955723,COMPLETED,"Kedua orang ini tinggal bersama secara tiba-tiba.
Bagaimana kisah cinta kedua orang ini yang punya pandangan dunia, kehidupan yang jauh berbeda?
Kisah cinta yang bikin kamu tersenyum sedang dimulai!",5,2021
The Savage World,3610,ROMANCE,"Woo Jihye, HWA JUNG, AR",MONDAY,Short,81067,1938517,154805,COMPLETED,"Selama 3 tahun, Lee Gijin telah hidup sebagai sekretaris Direktur Joo Jinhun dari Xitec Trading tanpa kebebasan sedikit pun dalam menentukan pilihannya. Dengan penjualan di Xitec Group yang memburuk, dia dipindahkan untuk membantu Presiden Direktur Joo Kanghyun yang sikapnya asal-asalan. Presiden Direktur Joo Kanghyun yang sulit diatur ini mungkin terbukti menjadi tantangan terbesar Lee Gijin dalam menjalankan tugasnya sebagai sekretaris.",5,2021
Trapped,3609,THRILLER,HAEMURI,SUNDAY,Short,390094,31835598,3935018,COMPLETED,"""Hanya seminggu sekali saja, bawa orang itu ke tempat yang aku suruh.""
Yunsu yang punya kekuatan misterius dan Chaea yang kena jebakan Yunsu.
Apakah Chaea bisa melarikan diri dari jebakan itu?",3.95,2021
Ocean's Promise,3608,FANTASY,Padhang Bulan,TUESDAY,Medium,214364,9709580,909441,COMPLETED,"Awalnya Seroja menganggap makhluk itu hanyalah bagian dari mitos dan dongeng untuk menghibur anak-anak. Namun semuanya berubah saat ia melihatnya dengan mata kepala sendiri. Ia mulai menyadari ikatan lain di antara mereka, selain janji dan rahasia gelap di baliknya.",2.85,2021
Musim Semi Pertama Bersamamu,3557,ROMANCE,Talk,"WEDNESDAY, SATURDAY",Short,66474,966987,107858,COMPLETED,"Sonya, seorang gadis Rusia yang menyukai fashion dan K-pop datang ke Korea sebagai siswa pertukaran pada hari musim semi yang hangat. Dalam cerita Sonya tentang adaptasi romantic selama 1 tahun dengan kehidupan Korea dengan keluarga Korea.
Ini adalah branded webtoon dari 2021 MOKKOJI KOREA ",5,2021
Diary Mystery,3507,HORROR,"Febs, Y.I.W",SUNDAY,Long,451710,31783866,2410113,ONGOING,"Mata batin yang selama ini tertutup, kini terbuka lagi. Hantu-hantu pun jadi mulai bermunculan di hadapanku.. dan mereka memintaku untuk mengungkapkan misteri kematian mereka?! ",5,2021
The Will to Share,3506,THRILLER,Kris & Tere,SATURDAY,Short,187020,6045547,667221,COMPLETED,"Awalnya semua murid di kelas Sol senang dengan aplikasi Pandora yang bisa menjawab pertanyaan mereka. Tetapi, aplikasi tersebut malah menyebarkan rahasia terburuk dari teman-teman sekelas Sol, bahkan Rei sepupunya sendiri. Rahasia ini bisa merusak hidup seseorang selamanya jika tidak dihentikan.",3.1,2021
Tell Me a Creepy Story!,3505,HORROR,dong kyu lee,WEDNESDAY,Long,131641,8823680,751326,ONGOING,Kumpulan cerita seram yang dapat membuat bulu kudukmu berdiri! Apakah kau berani baca komik ini di malam hari? ,5,2021
Pelayan Satu Semester,3504,ROMANCE,Kikaia,SATURDAY,Short,151258,6523006,510179,COMPLETED,"Alih-alih mencoba mengungkapkan perasaannya pada gadis yg ia sukai, Revan justru mendapat kesialan karena surat cintanya ditemukan oleh teman gadis yg disukainya. Karena tidak ingin surat itu bocor ia terpaksa harus menjadi pelayan Yesika selama satu semester!",5,2021
Daytime Star,3503,ROMANCE,"Chae-eun, Godago",FRIDAY,Short,536912,34999214,3382489,COMPLETED,"Yura Hwang, artis yang sudah berkarier 7 tahun tapi sejak dulu hanya mendapat peran pembantu saja. Orang yang dia kencani pun mengkhianati dan menikah dengan orang lain!
Semuanya terasa sangat buruk, sampai akhirnya dia bertemu kembali dengan aktor senior ternama di drama terbarunya.
Apakah perjalannya menjadi bintang utama akan tercapai?",4.1,2021
Sickomik,3502,COMEDY,Red Coco,"WEDNESDAY, SATURDAY",Long,239508,15980754,2244024,COMPLETED,Empat sahabat receh ini bakal bikin kalian geleng-geleng kepala sama kelakuannya!,5,2021
Double Click,3501,DRAMA,"Kim Janghun, Park Subong",TUESDAY,Long,191437,14947271,1165134,ONGOING,"Jiho, adalah pemain rank nomor 1 di dunia untuk One Sword, game yang terkenal dengan tingkat kesulitannya yang tinggi.
Game yang dia pikir layanannya telah terhenti, tiba-tiba muncul lagi di hadapannya!",3.3,2021
Arum Daun,3500,DRAMA,Shinshinhye,MONDAY,Short,206044,10513451,1943422,COMPLETED,Kisah seorang gadis yang berteman dengan sosok Alam. Apakah ia cukup kuat untuk menghadapi kehidupannya yang penuh dengan kemalangan? Ataukah ia akan memerlukan bantuan Sang Alam?,5,2021
An Uneasy Relationship,3499,ROMANCE,jans,SUNDAY,Medium,212669,11277418,847767,COMPLETED,"Rekan kerja 'Ira' dan 'Eundo' terbangun di ranjang yang sama setelah minum bir untuk menghibur satu sama lain setelah mereka patah hati. Dua orang ini dari rekan kerja menjadi sangat canggung setelah malam tersebut!

Tunggu dulu, memangnya apa yang terjadi di antara kita?!",5,2021
My Three Annoying Brothers,3498,COMEDY,olive-yu,FRIDAY,Medium,733687,36964074,4283761,ONGOING,"""Tiga anak laki-laki populer di sekolah adalah kakakku!""
Seumur hidupnya, Haeju tidak pernah mendapatkan kehidupan normal yang diinginkannya karena kehadiran ketiga kakaknya yang tampan dan populer. Karena hal tersebut, ketika memasuki SMA Haeju memutuskan untuk tidak memberitahukan relasinya dengan ketiga kakaknya kepada siapapun. Mampukah Haeju mendapatkan kehidupan normal yang didamba-dambakannya?",5,2021
Becoming You,3497,ROMANTIC FANTASY,"FURIK, LUNA, YOUNDAL",TUESDAY,Short,350160,26706773,2331844,COMPLETED,"Setelah menghabiskan malam bersama, Ailyn bertukar tubuh dengan Derick sang Putra Mahkota. Diam-diam, AIlyn memang merencanakan pertukaran itu untuk membebaskan Derick dari sebuah kutukan, sekaligus menyelamatkan keluarganya sendiri. Sialnya kutukan itu tidak punah begitu saja, malah mereka bisa tiba-tiba bertukar tubuh tanpa peringatan. Bagaimana caranya kembali ke tubuh semula selamanya?",3.1,2021
Fight Hard,3496,ACTION,38,SATURDAY,Short,318041,15234698,913010,COMPLETED,"Ada rumor lama di Macheon.
Ada desas-desus bahwa SMA Myeongsong adalah pusat pelatihan preman.
Tentu saja, itu masih hanya rumor.

Maka dari itu aku datang untuk mencari tahu.",5,2021
Change Me,3495,DRAMA,"JIHO LEE, HOTTI",THURSDAY,Long,218920,24881964,2556208,ONGOING,"Bagaimana jika kamu bisa hidup dengan wajah yang diinginkan, dengan syarat mendaftarkan diri pada asuransi jiwa yang mencurigakan? Curi wajah orang lain untuk mengubah hidupmu!",5,2021
The Holy Idol,3494,COMEDY,"studioM, AXA, mythology jin",TUESDAY,Short,188727,9300653,1334919,COMPLETED,"Aku Rembrary, utusan Tuhan yang dicintai semua orang, seorang Pendeta Agung yang suci!
Saat bertarung melawan raja iblis yang menghancurkan duniaku, aku malah terbangun dalam tubuh idol Korea yang tidak terkenal!

Bagaimana caranya aku kembali?! Apakah aku harus menyesuaikan hidup sebagai idol!? ",2.85,2021
Sierra,3493,ROMANTIC FANTASY,Studio wooridle,SUNDAY,Short,277289,9844049,954840,COMPLETED,"Ketika hanya tinggal pilihan tragis yang bisa dipilih Sierra, apakah dia akan memilih kebahagiaan dirinya atau kebahagiaan orang lain?",3.1,2021
Lovers of the Red Sky,3492,ROMANCE,"LICO, Jung Eun Gwol",SATURDAY,Short,174115,5241175,494714,COMPLETED,"Pada malam titik balik matahari musim dingin, Hong Cheon Gi yang lebih dikenal dengan panggilan Bandi, seorang pelukis dari Kelompok Baekyu, mendapati seorang pria yang jatuh dari langit.

Ha Ram, seorang pria yang menjadi buta setelah terlibat dalam kecelakaan ketika ia masih kecil,
setelah bertemu Hong Cheon Gi dia menemukan rahasia di sekitar matanya…
",5,2021
An Entanglement,3383,ROMANCE,"JQ COMICS, Lee jinyoung",THURSDAY,Short,59750,2376933,174466,COMPLETED,"Pria yang kukagumi tiba-tiba kehilangan istrinya. Rasanya aku ingin mendekatinya- eh, bentar, Gila! Aku kan sudah menikah...!",2.9,2021
The Secret of the Friendly Duke,3382,ROMANTIC FANTASY,Seojyu,WEDNESDAY,Short,134045,4462381,446851,COMPLETED,"Noelle yang terus menderita di kediaman keluarga Viscount, akhirnya bisa keluar dengan bantuan teman rahasianya yang ternyata seorang Duke bernama Zion?!
Noelle yang mahluk campuran ini pun akhirnya tinggal bersama Zion... Tapi.. sepertinya ada yang disembunyikan teman rahasianya ini...",2.65,2021
Hidden Beauty Formula,3381,DRAMA,rchella,TUESDAY,Short,90973,3832351,459076,COMPLETED,Kisah Rara yang mengejar mimpi untuk memiliki kulit wajah glowing! Apa kamu tahu cara mendapatkan hal tersebut?,5,2021
Perfect Marriage Revenge,3380,ROMANCE,"Jerryball, Yibambe, so young",MONDAY,Short,1001104,89740282,6949746,COMPLETED,"Baca webtoon “Perfect Marriage Revenge”, cerita asli dari drakor yang dibintangi Sung Hoon dan Jung Yoo-Min",3.3,2021
Daily JoJo,3379,ROMANCE,Donggun Lee,SUNDAY,Medium,41115,2856040,381499,HIATUS,"DARI AUTHOR YUMI'S CELL!
Eunjo, seorang pekerja kantoran biasa yang menunda pekerjaan hari ini sampai besok.
Sementara Jowan adalah orang yang mengatur segala sesuatunya secara sempurna dan terencana. Apakah mereka dapat menjalin hubungan rekan kerja yang baik?
",3.15,2021
Gadis Pembohong,3378,DRAMA,"Febs, Lulu Zet",SATURDAY,Short,107841,4560280,452854,COMPLETED,"Azki dikenal di sekolah sebagai anak yang pintar, cantik, pengkoleksi barang mahal dan tentu saja anak konglomerat.
Tapi sebenarnya itu semua... hanya bohong belaka?!",5,2021
CHUBBINESS!,3377,ROMANCE,Ivonne Febriani,FRIDAY,Long,269788,12981282,1218337,COMPLETED,"Katanya, cowok pertama kali tertarik melihat cewek lewat fisiknya dulu. Tapi kenapa cowok aneh ini bisa tertarik denganku?!",5,2021
One Day in Seoul,3376,THRILLER,Park chang geun,THURSDAY,Long,256312,22574402,2204775,ONGOING,"Sebuah virus mengerikan muncul di Seoul! Di hari yang sama Lee Yeongwoo dan teman-teman sekelasnya sedang berwisata ke sana. Mereka terjebak di suasana Seoul yang mencekam, dengan virus berbentuk gelembung-gelembung seperti telur kodok!",3.3,2021
I'm the Max-Level Newbie,3375,FANTASY,"WAN.Z, swingbat, Maslow",TUESDAY,Long,567375,59845082,4143434,ONGOING,"Jinhyuk, satu-satunya pemain game [MENARA UJIAN] yang menyelesaikan sampai akhir meski popularitas game telah menurun. Hingga suatu hari [MENARA UJIAN] menjadi kenyataan, Jinhyuk harus menyelesaikannya dengan segala elemen yang ia ketahui tentang game ini!",3.85,2021
Monster Duke's Daughter,3374,ROMANTIC FANTASY,"Han ocean, Chal Lan",SUNDAY,Short,699440,54124437,5033953,COMPLETED,"Lottie tiba-tiba muncul di kediaman Duke Demian dan ternyata Duke itu adalah ayah kandungnya, tapi Duke ini sering disebut sebagai Duke Monster! 
Apakah dia benar-benar monster? Dan kenapa ada novel yang mengatakan kalau Lottie tidak bisa hidup lama?",3.25,2021
Help Me,3373,THRILLER,Cheoljun6,FRIDAY,Short,61638,2085361,243794,COMPLETED,"Nenekku dibunuh oleh seseorang melalui aplikasi Help Me, aplikasi yang kugunakan untuk mendapatkan bayaran melalui tugas yang diberikan orang lain.

Aku harus mencari tahu siapa di balik tugas itu untuk mencari pelaku yang membunuh nenek!
",5,2021
Welcome on Board,3372,ROMANCE,Dani,WEDNESDAY,Short,56665,2353498,251432,COMPLETED,"Pekerjaan impian menjadi pramugari yang sudah lama ditunggu-tunggu! Aran bergabung dengan maskapai Air Wing-K setelah terkagum-kagum dengan pramugara Chaehyun yang merawatnya saat dia pingsan di pesawat. Apakah Aran dapat terbang Bersama Chaehyun? Ternyata fantasi dan kenyataan pekerjaan ini sungguh berbeda! 
Sebuah kisah penerbangan dengan pramugari baru Aran, Sunwoo, dan Chaehyun!
",5,2021
Bloody Romance,3371,ROMANCE,"JIHYUN SA, SEORU",TUESDAY,Short,299935,11986793,1360388,COMPLETED,"Karena masalah kesehatan, Hari harus mengurangi berat badannya jika dia ingin membuat konten mukbang kembali! Namun sebanyak apapun dia berusaha, beratnya tidak bisa turun. 

Tapi suatu hari, tiba-tiba teman sekelasnya On Doyun menghisap darahnya... Dan berat badannya berkurang?!
Namun masalahnya, ini baru pertama kalinya Doyun menghisap darah dan dia tak mau lagi melakukannya. Apa yang akan Hari lakukan?",5,2021
Psychic Studies,3370,COMEDY,Eun Hyuck Park,MONDAY,Short,208212,7538982,773295,COMPLETED,"'Mulai sekarang kamu akan dihipnotis...'
Kim Changyu, laki-laki culun yang menggunakan kemampuan hipnosisnya untuk mendapatkan popularitas di antara wanita, tetapi tidak pernah berhasil seperti yang dia inginkan.
Kisah Kim Changyu, yang berulang kali gagal, kisah yang istimewa namun menyedihkan. Ini bukan lelucon!",5,2021
Momfluencer,3369,DRAMA,"maemi, Hee Se",SATURDAY,Long,108087,10185629,882783,ONGOING,"Park Juyeon adalah seorang wanita biasa yang menjual produk anak di media sosial, sementara Kim Yehee, teman Juyeon yang ia benci sejak SMA, menikmati kekayaan dan popularitas dengan 700.000 pengikutnya. Akankah kebencian dan obsesi Park Juyeon dapat mengungkap masa lalu Kim Yehee dan menjadi seorang selibriti?",5,2021
His Ruse,3368,ROMANCE,"Lee Chae-young, One Universe",THURSDAY,Short,149699,7287006,660604,COMPLETED,"Yoon Ina hendak menembak Kak Juhyung yang tampan dan baik hati. Tapi saat aku hendak menembak dengan memberikan surat, surat itu justru diterima kakaknya, Kak Gunho, yang dari dulu sepertinya membenciku!

Dan dia menerima pernyataan cinta suratku?! Aku harus apa?!",5,2021
The Druid of Seoul Station,3367,FANTASY,"Mun sung ho, liveBEAR, Jin Seol woo",WEDNESDAY,Long,256036,18681920,1215398,HIATUS,"Suho, kembali ke Bumi setelah seribu tahun menghilang di dunia lain.
Namun, dunia yang dulu ditinggali sekarang telah berubah menjadi dunia kebiadaban dengan munculnya monster-monster!",5,2021
Never-ending Darling,3366,THRILLER,Woollee,SUNDAY,Short,133255,7146029,886362,COMPLETED,"""Aku menemukan tubuhku yang sudah mati di rumah pacarku..."" Era di mana kehidupan dapat diperpanjang melalui teknologi duplikat. Inilah kisah Yoon Haim bersama dengan pacarnya, Ji Geunhoo yang menciptakan teknologi ini.",3.35,2021
Not My Type,3365,ROMANCE,"Park Yun young, endong",SATURDAY,Short,381203,16851636,1304364,COMPLETED,Kisah mencari jodoh antara wanita 29 tahun yang sudah terbiasa berpacaran dan seorang pria 29 tahun jomblo yang belum pernah berpacaran! Apakah Cha Euntae yang sudah sering berpacaran dapat jatuh cinta pada Kim Jinhyun si jomblo seumur hidup yang punya fashion sense jelek dan hanya main game di akhir minggu?,5,2021
You and Me,3234,ROMANCE,sang ha,FRIDAY,Short,29430,1927616,294777,COMPLETED,"3 tahun semenjak Baek Soyeon, gadis yang selalu membela Han Siah setiap kali ia ditindas, pergi dan sekarang tiba-tiba ia kembali. Perasaan yang dipendam Han Siah masih sama, begitu pula perasaan Baek Soyeon. Apakah mereka bisa mengutarakannya? 

Ini kisah tentang mereka menghadapi waktu yang berlalu.",5,2021
Back Stage Kiss Scene,3233,ROMANCE,"C.Do-B, Su Jeong Gwa",SATURDAY,Short,166062,5641866,454910,COMPLETED,"Yoon Ga-eul, aktris papan atas no.1 di Korea tiba-tiba mengumumkan pengunduran dirinya dari dunia hiburan!?
Kemudian dia memutuskan untuk tinggal di rumah yang ditinggali oleh dua pria?!",5,2021
Onsaemiro,3232,ROMANCE,"yeo-woo, samoon",FRIDAY,Short,206614,7411374,748243,COMPLETED,"Haeri Jin adalah seorang aktris muda yang mencoba audisi drama bertema kerajaan Korea dahulu. Dia pun mengunjungi museum dan melihat pedupaan yang indah dan meminta permohonan. 

Dan tiba-tiba malamnya, muncul laki-laki berpakaian baju jaman dulu dan berkata kalau dia seoarang dewa?! Dan ternyata Haeri adalah reinkarnasi orang yang dikenal dewa itu?!",2.9,2021
One Bite per Month,3231,ROMANCE,"Itsumarin, Deruu RioTa",THURSDAY,Short,180984,3864357,306046,COMPLETED,"Ketika sebuah kos-kosan mengharuskan kalian untuk membayar bukan dengan menggunakan uang melainkan darah, apa kalian masih ingin ngekos disana?",5,2021
Suhee0,3230,DRAMA,Birthdaymood,WEDNESDAY,Long,112361,6451493,697665,ONGOING,"Suhee tidak sengaja muncul di tayangan live adiknya dan ternyata para penonton menyukainya! Mereka meminta Suhee tampil live streaming lebih sering. Sebagai imbalannya para penonton memberi Suhee uang setiap kali tampil. Suhee berpikir untuk serius menjadi live streamer karena ia butuh uang untuk membantu ayahnya yang sakit serta membesarkan dua orang adiknya. Tetapi, apa benar itu adalah cara yang mudah untuk memperoleh uang? Atau... dia akan menemukan masalah?",2.65,2021
Bad Word Baby,3229,SLICE OF LIFE,El Nareswara,"TUESDAY, THURSDAY",Short,246880,18946466,2290602,COMPLETED,"Kebayang gak sih, punya pacar yang pemarah,senang mengumpat, dan gualaaaknya minta ampun??? Udah gitu bundamu paling alergi sama kata-kata kasar! Jangan sampai deh mereka berdua bertemu!",5,2021
The Remarriage Contract,3227,ROMANCE,"Seolwoohee, JEJE",SUNDAY,Short,302857,21470074,1667808,COMPLETED,Sebuah tawaran pernikahan kontrak dari mantan suami! apakah kau akan menerimanya...?,2.85,2021
Pupus Putus Sekolah,3226,SLICE OF LIFE,Kurnia Harta Winata,"MONDAY, FRIDAY",Long,746203,92478246,9344514,HIATUS,"Sekolah itu sungguh menyebalkan! Tapi Pupus ingin pintar, bisa ini bisa itu. Pintar tanpa sekolah. Harusnya itu impian yang wajar-wajar saja, kan?",5,2021
Prince Maker,3225,ROMANTIC FANTASY,suosu,THURSDAY,Short,221603,8712930,1109318,COMPLETED,"Setelah menanti selama 10 tahun, Sang Putri akhirnya diselamatkan oleh Sang Pangeran dari menara. Mereka pun akan menikah dan hidup bahagia... TUNGGU DULU! Sebelum mereka sempat memadu kasih, seorang penyihir mengutuk Sang Pangeran menjadi bocah kecil yang super menggemaskan. Sepertinya hidup bahagia selamanya harus menunggu dan petualangan kocak yang menggemaskan menanti di depan mata!",2.85,2021
The Predator,3224,THRILLER,"Shin Heebin, Chi Chi",WEDNESDAY,Medium,146142,7444018,692411,COMPLETED,"Sangjin, seorang pria berusia 25 tahun, memiliki teman yang berubah menjadi monster di samping kamarnya. Untuk mencari mangsa monster itu, dia mencari manusia yang penuh keserakahan dan kebusukan setiap malam. Apakah Sangjin dan monster itu benar-benar penyelamat umat manusia? atau hanya sepasang predator?",2.8,2021
A Summer Night's Dream,3223,ROMANCE,"Kim su bak, Kan",TUESDAY,Short,234026,9131926,995450,COMPLETED,"Yeoreum yang jadi guru praktik di sekolah lamanya, memiliki kemampuan untuk mempertemukan orang dalam mimpi.

Namun saat dia ingin menjodohkan muridnya dalam mimpi, murid cowoknya yang bernama Park Siwoo justru sadar dalam mimpinya dan menyadari gurunya punya kemampuan khusus!

Yeoreum pun jadi tidak bisa lepas dari Park Siwoo yang sudah tahu kemampuannya!",3.4,2021
Jangan Mendekat,3222,ROMANCE,"Baek HA NA, Jimmy",MONDAY,Short,145843,6661763,486049,COMPLETED,"Yunju Song adalah seorang wanita karir yang memisahkan antara kehidupan profesional dan asmaranya. Setelah bertekad untuk tidak membiarkan pria untuk menghancurkan performa kerjanya, muncullah seorang pria yang akan mengubah segalanya!!",5,2021
