title,title_id,genre,authors,weekdays,length,subscribers,views,likes,status,synopsis,rating,year
Tears on a Withered Flower,7322,ROMANCE,GAE,THURSDAY,Short,371041,10996416,574548,ONGOING,"Suami Haesoo tega berselingkuh dengan teman kantornya yang masih muda. Padahal, Haesoo yang sangat setia susah payah bekerja serabutan demi membantu sang suami membayar hutang! Di kehidupannya yang hampa dan layu, tiba-tiba seorang pria muda datang menawarkan rasa perhatian yang tak pernah Haesoo dapatkan lagi. ",3.6,2025
Pasutri Kentang,7321,SLICE OF LIFE,GAMZA,WEDNESDAY,Medium,16834,476248,74794,ONGOING,"Apa jadinya kentang menikah dengan manusia?
Kadang ribet, kadang absurd, kadang kocak, namun hari mereka diisi dengan kebahagiaan sederhana.
Ada yang bilang pasangan biasanya mirip, apakah itu berlaku juga untuk pasutri baru ini...?",5,2025
The Case of Joseon Queen Selection,7260,ROMANTIC FANTASY,"KANG DA HYE, Wol Woo",TUESDAY,Short,42268,1076345,96254,ONGOING,"Yun diperintahkan oleh raja untuk menyelidiki lima wanita untuk menemukan calon ratu. Untuk lebih mudah mendekati para wanita tersebut, ia membuat kontrak dengan Seo-kyung, penjaja paling berbakat yang menjual barang kepada para wanita, dan menyamar sebagai pasangan suami istri dan memulai perjalanannya untuk menemukan ratu terbaik Joseon!",5,2024
My Stepdaughter is a Bunny,7258,ROMANTIC FANTASY,"Karin Park, Sisse",TUESDAY,Medium,100654,2500021,265416,ONGOING,"Setelah mati dan hidup kembali, aku terbangun di hari pernikahan, tepatnya pernikahanku dengan Duke Grayan Salisbury, pemimpin para serigala yang berparas menawan tetapi bersikap dingin.

Rupanya aku terlahir kembali sebagai Gloria Einstern, seorang penjahat yang membenci manusia setengah hewan. Padahal, pernikahanku dengan Duke membuatku memiliki anak tiri yang lucu dan cantik. Ditambah lagi, dia adalah manusia setengah kelinci yang sangat imut!

Bisakah aku mengubah 'image' jahatku dan menikmati kehidupan bersama putri kelinci serta suami serigalaku dengan bahagia?",2.65,2024
The Ki Sisters,7256,COMEDY,bumbae,WEDNESDAY,Medium,132668,3369379,404028,ONGOING,"Queen never cry! Ada saja kelakuan ""unik"" Ki Sisters, empat bersaudara dengan sisi tersendiri masing-masing yang bisa membuat tertawa hingga geleng-geleng kepala.
Kalau dipikir-pikir... apa cuma keluarga Ki Sisters yang kelakuannya seperti tujuh keajaiban begini?! Jangan-jangan masih ada lagi?!",3.5,2024
To Drown In You,7220,THRILLER,"Sung sil, Jaengnwo",MONDAY,Medium,22433,458800,46501,ONGOING,"Siapa sangka, ternyata teman laut Geum Hyesung yang ditemuinya waktu kecil, Yoonhae, muncul kembali saat dirinya sudah tumbuh besar.
Seiring berjalannya waktu, Hyesung bisa merasakan ""cinta"" yang ditunjukkan Yoonhae, tapi kenapa lama-lama... ""Cinta"" itu terasa... menyesakkan?",2.85,2024
Lock Me Up! Duke,7219,ROMANTIC FANTASY,"Kisai Entertainment, ⓒGLEE CAT, AriaSama, Nana.maruse, Ndelooknow Studio, Ha Min Seon",SUNDAY,Medium,152803,4899903,345062,ONGOING,"Ketika dihadapkan pada akhir cerita yang buruk, semua orang pasti akan berusaha menghindarinya, bukan? Tapi, itu tidak berlaku untuk A-Min Kim. Terlahir kembali sebagai Jaina Blake, karakter utama dari game favoritnya: *""How to Fall in Love with the Obsessed Man""*, A-Min Kim justru bertekad untuk mendapatkan ending terkunci. Makanan gratis, tidur tanpa batas, dan tidak perlu bekerja! Siapa yang bisa menolak? Setidaknya, bukan Jaina!",5,2024
When The Food is Too Spicy,7218,ROMANCE,"Kristal Lensi, Uraki, Linka08",FRIDAY,Short,61522,1476708,76743,HIATUS,"Apa yang akan kamu lakukan jika kamu mencurigai tunanganmu berselingkuh? Gadis menemukan petunjuk bahwa tunangannya, Igor, mungkin selingkuh darinya, sehingga dia memutuskan untuk mencari tahu sendiri di Jakarta. Kesialan menimpanya dan mengharuskan dia bertemu dan bahkan meminta tolong pada seseorang di masa lalunya bernama Luki. Padahal, Gadis sudah berjanji pada dirinya sendiri tidak akan mau berhubungan apapun lagi dengan Luki, karena Luki adalah... mantan FWB-nya!",5,2024
Until I Destroy My Husband's Family,7217,ROMANCE,"Nazuzu Nagihama, Mana Akaishi",FRIDAY,Short,80239,3652485,288004,ONGOING,"Minori (31 tahun) menjalani hidup bahagia bersama seorang putra dan suami yang sudah menjadi pacarnya sejak sekolah dulu.

Hari-hari damai itu hancur ketika Minori mengintip ponsel suaminya, Yudai.

Minori mengetahui perselingkuhan suaminya dan dia menyaksikan Yudai duduk bersama orang lain di meja seperti sebuah keluarga beranggotakan tiga orang dengan seorang wanita asing dan putranya yang siswa SMA.

“...Keluarga siapa itu?”

Setelah mengetahui pengkhianatan suaminya selama bertahun-tahun, Minori mulai merencanakan balas dendam untuk menghancurkan ""keluarga lain"" yang disayangi Yudai.",5,2024
Audition in Disguise,7216,ROMANCE,"YUNSOOP, GOHADA",WEDNESDAY,Short,26770,850552,116121,ONGOING,"Lee Chohee bermimpi menjadi seorang idola, tetapi dia selalu tersingkir dari grup debut karena penampilannya yang tomboy dan kesialan yang menimpanya.

Akhirnya dia memutuskan untuk mengambil kesempatan terakhir dan mendaftar ke acara idol survival bernama ""High Teen Universe""... Namun ternyata, dia harus menjadi pria (?)

Inilah kisah cinta dan persahabatan antar trainee idol yang seru dan mendebarkan!",5,2024
The Sacred Life of a Webcomic Artist,7215,ROMANCE,JOOYA,MONDAY,Short,43292,863533,69642,ONGOING,"Author dan ilustrator webtoon dewasa, Sung Hayoon, memasuki slump era! Sudah begitu, PD yang bertanggung jawab atasnya juga diganti?!
Tenang, PD baru Hayoon sepertinya lebih baik... Lalu author yang akan bekerja sama dengannya kini pun... Eh? Siapa? Mantan pacarnya?!",5,2024
Electrifying Confession,7214,ROMANCE,"nyangji, SONCHAYANG",SUNDAY,Short,164839,4917636,456684,HIATUS,"Katanya jatuh cinta itu menyenangkan.. Tapi bukan begini!

Gara-gara cinta tak berbalas, Hari malah mendapat kutukan. Aliran listrik yang sangat kuat akan menyambar tubuhnya jika angka detak jantungnya melebihi batas.

Masalahnya, jantung Hari selalu berdebar tidak karuan setiap kali berdekatan dengan Yoon Jeongwon. Dan orang yang bisa menghentikan debaran itu hanyalah Baek Yoora!

Apakah Hari akan bekerja sama dengan Yoora untuk mengatasi kutukan? Atau mengakhiri cinta tak berbalas terhadap Jeongwon?

Kisah cinta pertama Hari yang mendebarkan (dan menyetrum) dimulai!",5,2024
The Pretender,7203,ROMANTIC FANTASY,"Blacklapiz, Amae",SATURDAY,Short,58001,922252,109519,HIATUS,"Vitalius Pavel, pangeran ke-4 Dinasti Tavitian menyadari bahwa dirinya kembali ke masa lalu di mana ia dibunuh oleh kekasihnya Bellatrix Papilia. Tapi apakah benar begitu kenyataannya? Siapa Bella sebenarnya? ",5,2024
"Get It Together, Girl",7202,ROMANCE,Jemin,FRIDAY,Medium,29799,773846,81549,ONGOING,"Seungyeon yang populer berkat wajahnya yang cantik, badannya yang tinggi, dan auranya yang unik, bekerja paruh waktu di warnet dan sering kali menarik perhatian laki-laki di sekitarnya. Sekarang dia adalah seorang mahasiswa tahun ke-4, jadi dia harus fokus pada studinya, tapi Seungyeon sulit untuk melepaskan pekerjaannya. Di saat yang sama, dia bertemu Yibeom, yang cukup menarik di matanya…",5,2024
At Your Mercy,7200,ROMANTIC FANTASY,"Team honeybread, Team Lightsalt, Early Flower",THURSDAY,Short,181433,3770534,231163,HIATUS,"Han Jian yang awalnya menjalani kehidupan normal, tiba-tiba 'masuk' ke dalam novel yang sedang dia baca. Masalahnya ini adalah 'perpindahan jiwa'-nya yang kedua kali! Ditambah lagi, karakter yang menampung jiwanya ini dikenal sebagai putri yang 'bodoh'!

Di tengah kebingungannya, muncul seorang pangeran di dunia novel ini yakni Grand Duke Iskan Anagrok. Pria itu pun menunjukkan ketertarikannya pada putri 'bodoh' tersebut! Bisakah Jian bertahan hidup di dunia ini?",5,2024
Fullmetal Alchemist,7199,FANTASY,Hiromu Arakawa,TUESDAY,Short,13354,255591,35912,ONGOING,"Petualangan Edward dan Alphonse, kakak beradik yang ingin menghidupkan kembali ibu mereka melalui alkimia dimulai! ⓒHiromu Arakawa/SQUARE ENIX CO., LTD.",4.45,2024
Please Kill My Husband,7198,ROMANTIC FANTASY,"GUMUL, Lee Yone, CANNT WORKS",MONDAY,Short,78767,2293741,99672,ONGOING,"Gara-gara kejatuhan keluarga Ruttengard, Brienne dijodohkan dengan Derrick Astahel, seorang baron kaya dari wilayah selatan. Awalnya, Derrick terlihat sebagai pria yang baik, namun sifat aslinya segera terungkap dalam perjalanan mereka ke wilayah Derrick. Kehidupan pernikahan Brienne bagai neraka, dan 8 tahun kemudian… Brienne menjadi tersangka pembunuhan suaminya. Brienne diduga dibantu oleh salah satu dari tiga pria, yang mana ketiganya pernah terlibat skandal dengannya!",3.1,2024
Maru Si Guguk,7197,SLICE OF LIFE,Mojo,SUNDAY,Medium,17824,493001,90249,ONGOING,"Choi Woori tinggal seorang diri bersama anak anjingnya, Maru – hingga suatu hari Maru berubah menjadi manusia! Kini, Woori harus menjadi kakak bagi Maru yang setiap hari membuat ulah! Bagaimana kehidupan Woori bersama Maru yang dulunya seekor anjing itu?",5,2024
The Empire's Cutest Little Hostage,7196,ROMANTIC FANTASY,"Uanke, HN, Darongkkot",SATURDAY,Medium,130704,3822110,305278,ONGOING,"Untuk menghindari hidup penuh penderitaan yang berakhir dengan kematian di bawah ayah tirinya, Elaine yang kembali menjadi bocah menyamar sebagai Putri agar dibawa ke kekaisaran sebagai tawanan! Elaine bertekad membuktikan bahwa dirinya berguna agar tidak dikirim kembali, tapi keimutannya malah membuatnya diadopsi oleh kaisar. Tak berakhir di situ, Elaine juga harus menghadapi ibu suri yang menyeramkan dan kakak-kakak barunya yang juga menakutkan. Mampukah Elaine merebut hati rakyat kekaisaran?",2.65,2024
Ordeal,7191,FANTASY,Brent Bristol,THURSDAY,Medium,23336,592524,38821,ONGOING,"Che hanyalah seorang manusia biasa di dunia yang dipenuhi ""Kimyo"" berkekuatan super, namun dia bertekad menjadi petarung terhebat sepanjang masa. Ketika mentor yang paling dia hormati dibunuh, Che bersumpah untuk membalas dendam dan memulai perjalanan untuk menemukan pelakunya.

Tak perlu waktu lama bagi Che untuk menyadari bahwa dunia para Kimyo jauh lebih luas dari yang pernah dia bayangkan. Dia bahkan menemukan kebenaran mengejutkan: dirinya mungkin adalah Kimyo terkuat di Bumi, dengan kekuatan dari matahari.

Mampukah Che mengendalikan kekuatan barunya, atau justru akan hancur terbakar oleh bara ujian yang harus dia hadapi?",5,2024
My Only 1,7190,ROMANCE,EGGKIM,WEDNESDAY,Short,130601,5095844,161002,COMPLETED,"Melelahkan, Yoo Haneul kini sudah mulai menyerah akan cintanya... Di saat seperti ini, tiba-tiba dia bisa melihat angka-angka yang tertulis pada tubuh semua orang yang dilihatnya. Belum menemukan jawaban atas kebingungan ini, Haneul bertemu dengan Jeon Haerim. Dari sini kebingungan dan kegilaan pikiran Haneul bermula, sebenarnya apa arti semua ini?!",5,2024
Ada Apa dengan Dadaku?,7189,SLICE OF LIFE,mooolung_e,MONDAY,Short,23974,920583,65821,COMPLETED,"Masih ingat dengan apa yang terjadi di tahun 2020? Benar... Pandemi itu, lho!
Karena kejadian itu, aku harus mendapatkan vaksin.
Siapa sangka, ternyata vaksin membuat bagian tubuh favoritku membesar! Yep, dadaku membesar!!!",5,2024
The Losing Streak,7188,ROMANCE,"Hongwa, Peralta",SUNDAY,Short,55943,1450233,40160,COMPLETED,"Selama Shin Seungah menjadi penggemar tim ""Futures Victory"", tim bisbol itu selalu mendapatkan peringkat terakhir. Kekecewaan dan kemarahannya terhadap tim tersebut membuat Seungah memutuskan untuk berhenti menjadi penggemar bisbol setelah menonton pertandingan mereka untuk yang terakhir kalinya.



Namun, hal yang tak terduga terjadi pada momen 'kiss time' di pertandingan tersebut. Saat Seungah mencium Choi Jon, fans bisbol yang ada di sebelahnya, tiba-tiba tim ""Futures Victory"" meraih kemenangan!

Sejak saat itu, Seungah menyadari bahwa semakin intim hubungan antara dirinya dan Choi Jon, semakin berdampak positif bagi tim yang mereka dukung. Mereka pun memulai 'proyek kejuaraan tim' bersama-sama!",2.9,2024
The Roguish Guard in a Medieval Fantasy,7187,FANTASY,"kimgarden, Studio MW, wm, gomdol-ineun",SATURDAY,Short,21461,431710,38800,HIATUS,"Terlempar ke dalam cerita fantasi berlatar abad pertengahan?! Dengan kondisi dunia yang sangat kejam dan dikuasai perang, sihir, serta berbagai hal aneh lainnya, Aaron harus menjabat sebagai ketua tim penjaga. Mampukah Aaron bertahan hidup di masa ketika hukum dan pandangan moral masih sangat primitif? ",3.2,2024
Moonstruck,7186,ROMANCE,"youngmo, jellyfish",THURSDAY,Short,64247,2320631,146485,ONGOING,"Godaan ada di mana-mana! Seberapa kuat ketulusan keteguhan hati manusia? Bagaimana jadinya jika hal-hal yang memanusiakan manusia diuji oleh berbagai macam godaan yang mungkin tak pernah terpikirkan sebelumnya? Hati-hati dengan sekeliling, mereka siap menggoda!",3.35,2024
To Have an Affair,7184,ROMANTIC FANTASY,"Team Woosa, SOY MEDIA, Son Sehee",TUESDAY,Medium,195090,5220191,316243,ONGOING,"Scarlett Chandler dibesarkan sebagai putri yang penurut sepanjang hidupnya. Demi menjalankan perintah ayahnya, dia pergi ke ibu kota untuk menikah dengan Duke Huntington.

Namun, sang calon suami ternyata sudah memiliki simpanan, dan Scarlett hanya dianggap sebagai tabir untuk menyembunyikan hubungan tersebut serta 'alat' untuk melahirkan keturunan. Ayah Scarlett pun telah mengetahui kebusukan calon menantunya dan tetap 'menjual' Scarlett kepadanya.

Scarlett akhirnya sadar bahwa kepatuhannya tidak mendatangkan cinta, dan berniat untuk membalas dendam demi mendapatkan kebebasannya. Tapi di tengah usaha balas dendamnya itu, seorang kesatria tampan dan calon suksesor kekaisaran malah mendekatinya!",5,2024
Absolute Reign,7183,FANTASY,"sidae, Y.H.JANG",SUNDAY,Medium,56424,2315203,183585,ONGOING,"Sang legenda, Jeok Yigeon, tetap tidak bisa binasa walau nama-nama besar legenda lainnya seperti Naeng Yisang, Yang Hwayeong, dan Cheon Mu Ak dikirim untuk membunuhnya.
Sebenarnya ada apa? Kenapa mereka malah menghilang?
Apa sebenarnya yang terjadi pada mereka semua?!",5,2024
Still Glittering,7075,DRAMA,Sloth,WEDNESDAY,Short,12329,236376,38396,COMPLETED,"Sepuluh tahun setelah lulus SMA, sekolompok sahabat lama yang pernah mengalami tahun-tahun terindah bersama akhirnya tumbuh menjadi orang dewasa yang paling tidak mereka inginkan. Hingga salah satu teman mereka, Wan'Er menghilang. Mereka berkumpul bersama lagi, untuk mencari dan mengetahui nasib Wan'Er. Mau tidak mau, mereka saling terlibat kembali dalam hidup satu sama lain.",5,2024
Love Again?,7051,DRAMA,oliolio,FRIDAY,Medium,9377,112702,7955,ONGOING,"Hidup ini penuh dengan variabel dan hal yang tidak diketahui. Ketika membuat keputusan, apakah kamu benar-benar yakin bahwa pilihan itu benar? Jika kita dapat memahami sebab dan akibat lebih awal, apakah kita masih akan membuat keputusan yang sama tanpa penyesalan? Lin Jingyue dan Jin Xuanyu adalah pasangan yang pernikahannya di ambang kehancuran. Dalam perjalanan untuk mendaftarkan perceraian, Jingyue mengalami kecelakaan mobil. Ketika dia bangun lagi, dia menemukan bahwa dia telah kembali ke tahun ketika dia pertama kali bertemu dengan satu-satunya pria yang pernah dia cintai dalam hidupnya, Jin Xuanyu. Takdir memberinya kesempatan untuk menciptakan kembali hidupnya dan membawa mantan kekasihnya, Lance, ke dalam kehidupan barunya. Pada titik awal cinta ini, akankah Jingyue memilih nasib yang sama lagi tanpa penyesalan atau menciptakan kemungkinan lain?",5,2024
Tied into Love,7046,ROMANCE,Leebum,SATURDAY,Short,29992,359102,28523,HIATUS,"Lee Siwon adalah penulis thriller terkenal yang tak pernah gagal dalam mencetak karya ‘best seller’. Di puncak karirnya, muncullah kasus pembunuhan yang menghebohkan semua orang dikarenakan metodenya yang mengikuti metode dalam novel thriller milik Lee Siwon yang berudul “Rope”. Akibat rasa bersalah dan traumanya, Lee Siwon meninggalkan genre thriller dan memutuskan untuk menulis novel romansa… Tapi masalahnya, Lee Siwon tak punya pengalaman yang bisa membantunya. Pada akhirnya, ia meminta teman lamanya, Sodam, untuk belajar tentang ‘cinta’. Apakah hubungan mereka akan menyerupai novel romansa sesungguhnya?",5,2024
I Simply Cared For My Frail Father,7044,ROMANTIC FANTASY,"HANA, JENJEN, Moksaedal",FRIDAY,Short,149583,4227161,355812,HIATUS,"Yvriel kembali ke masa lalu setelah mati di tangan kaisar yang ingin menyingkirkan keluarganya. Kali ini, Yvriel harus mencari cara agar ayahnya kembali sehat dan melindungi keluarga mereka!",5,2024
Transference,7043,ROMANCE,Hyang-yu,WEDNESDAY,Medium,60162,1472677,166732,ONGOING,"Gong Sooah si mahasiswi ""membosankan"" bertemu dengan seniornya di kampus, Yoon Taeyang yang entah kenapa tiba-tiba menangis saat menerima buku darinya.
Ternyata hal itu mulai terjadi padanya sejak SMA, apa benar Taeyang bisa merasakan perasaan yang dirasakan orang lain hanya dengan melihatnya?
Inilah pertemuan antara lelaki yang terlalu perasa, dan perempuan tak bisa merasakan lebih dari kata cukup.",5,2024
The Knight Only Lives Today,7042,FANTASY,"IAN, Lee hyunmin, soulpung",TUESDAY,Medium,39724,1479242,139752,ONGOING,"""Kau mungkin bisa jadi kesatria.""

Kalimat yang didengar Enkrid saat masih kecil ini mendasari mimpinya untuk menjadi seorang kesatria. Namun, seiring berjalannya waktu, dia sadar bahwa usaha untuk meraih mimpinya itu berakhir sia-sia.

Walau semua orang menertawakan dan meremehkannya, Enkrid tetap berjuang dan berlatih sekuat tenaga. Hingga suatu hari, dia ditikam dan berakhir meninggal di medan perang.

Saat Enkrid berpikir mimpinya sudah kandas, dia kembali terbangun pada 'hari kematiannya'. Apakah ini kesempatan yang diberikan kepada Enkrid demi mewujudkan mimpinya menjadi kesatria?",5,2024
I Grabbed the Leash of the Blind Beast,7041,ROMANTIC FANTASY,"The Greedy Gatsby, PPANG, Kayeh",TUESDAY,Medium,261434,8238168,559085,ONGOING,"Grand Duke sekaligus Kesatria terhebat kekaisaran, Ileon Clevent, kehilangan penglihatannya akibat perang dan mengalami depresi akut. Namun, berkat kemunculan pelayan baru bernama Rona, Ileon berhasil bangkit dan menjalani kehidupannya lagi.

Rona juga mencoba untuk memulihkan penglihatan Ileon, tetapi di tengah prosesnya, dia menemukan identitas aslinya dan kembali tinggal bersama keluarganya tanpa sempat berpamitan dengan Ileon.

Saat Ileon mendapatkan penglihatannya kembali, dia pun menjelajahi kekaisaran demi menemukan Rona. Apakah Ileon akan berhasil menemukan Rona dengan identitas aslinya?",5,2024
No Office Romance!,7040,ROMANCE,"Dooboo, Namsoo",MONDAY,Medium,42656,1033650,110894,ONGOING,"Apa benar cinta pertama itu istimewa?
Jika bertemu lagi dengan cinta pertama di usia dewasa,
apakah kita masih akan berdebar-debar?

Dari cinta pertama ke teman, dari teman ke rekan kerja.
Bisakah kami mempertahankan misi untuk tidak menjalin hubungan percintaan di kantor?

Karya kolaborasi author ""One of a Kind Romance"" Dooboo dengan author ""Proper Dating Guide"" Namsoo. Inilah kisah romantis di kantor yang diciptakan oleh dua penulis romansa yang terpercaya!",5,2024
Falling into Your Hands,7039,ROMANCE,SU momo,MONDAY,Short,28193,477175,32084,ONGOING,"Miao Caichun, perempuan yang terobsesi dengan tangan indah seniornya ditolak!!
Tapi tak apa, karena ternyata ada Gu Lidun, yang tangannya pun indah, yang sudah memerhatikan Caichun sejak dulu.
Bertemu lagi setelah dewasa, sepertinya semesta mempertemukan mereka kembali.
Apalagi setelah Caichun ditolak oleh lelaki sampah, Gu Lidun kini berperan sebagai pacar yang akan mengajari Caichun bagaimana caranya memilih lelaki yang benar!
Bagaimana jadinya dinamika hubungan cinta dua orang ini...?",5,2024
For the Princess Who Will Disappear,7038,ROMANTIC FANTASY,"Rimha, Migi, 942",SATURDAY,Short,87117,1712247,128777,COMPLETED,"Apakah mungkin jika aku yang hidup berdampingan dengan para pencuri jalanan ini, sebenarnya adalah seorang putri...?

Sasha tumbuh besar di sebuah gang kumuh kecil yang dipenuhi pencuri jalanan. Namun karena salah menjual sebuah kalung, Ia malah masuk ke keluarga kekaisaran?!

Inilah kisah cinta antara 'Sasha', seorang putri cerdas dan berani dari sisi yang gelap, dan 'Lascan', Duke berdarah dingin yang diam-diam melindungi Sasha!",5,2024
My Virtual God is a Teenage Girl,7037,DRAMA,"Park Jang Go, Yi Woo",SUNDAY,Medium,37267,1220973,115653,ONGOING,"Meski hidup Jumin penuh ketidakberuntungan, ia tetap mampu sukses dan bahagia bersama istri dan anaknya... hingga pada suatu hari, semua itu direnggut darinya, dan sebuah 'sosok' yang bisa mengontrolnya muncul. Ternyata, selama ini Jumin adalah karakter dalam game simulasi yang dimainkan oleh anak SMA! Dengan sekali klik, anak tersebut dapat membuat apa pun terjadi di dunia Jumin berada. Tak tahan lagi ditindas bagai boneka, Jumin bertekad untuk terbebas dari game simulasi bagaimanapun caranya!",5,2024
Locked Up by My Mad Dog,7036,ROMANTIC FANTASY,"Choi Hwain, Hangaga, Eun GaVit",SUNDAY,Short,143875,2041045,106547,ONGOING,"Masuk ke dalam tubuh  Elizabeth Cretian membuatku kebingungan! Apalagi setelah tahu bahwa selain memiliki Carsis sebagai ""pengawal"" yang melayaninya siang malam, Elizabeth juga ternyata mempunyai kehidupan yang janggal.
Sebenarnya hidup seperti apa yang dijalaninya selama ini?! Kenapa begini?!",5,2024
Love Roasting,7035,ROMANCE,"I SOON KI, I YE RIN",FRIDAY,Medium,90835,1429557,98822,COMPLETED,"Dua pasangan tiba di Pulau Jeju yang indah! Pasangan berusia 20-an yang muda dan berapi-api serta pasangan berusia 30-an yang terjebak dalam dilema hidup. Keduanya bertemu dan menghadapi konflik, menaklukkan bimbang, juga menjalani berbagai proses pendewasaan. Apakah Jeju akan membantu merekatkan, atau malah... menambah rintangan?",5,2024
All for My Dearest Juliet,7034,ROMANTIC FANTASY,"sam mil sam, Nessa, Getaway Car",THURSDAY,Medium,135932,3304219,263894,ONGOING,"Akibat sakit-sakitan seumur hidupnya, Juliet tak bisa menjalani hidup 'biasa' sebagai seorang putri Kerajaan Rosenta. Sebersit kebahagiaan menghampirinya saat ia bertemu dengan seorang pelayan dari delegasi Kekaisaran Nassant, dan menghabiskan waktu dengannya. Namun, kebahagiannya tidak berlangsung lama, karena Juliet ternyata akan dinikahkan dengan Grand Duke dari Herventel, Enoch Letrachi, yang selama ini ia kira pelayan. Bisakah Juliet mencintai pria tersebut, di saat ia tak lagi bisa percaya padanya?",5,2024
This is a Campus Romance Series,7031,ROMANCE,Kite,SATURDAY,Medium,45314,1208834,99744,ONGOING,"Lee Hayun, anak kuliahan yang biasa-biasa saja, sudah lama nggak jatuh cinta. Pada suatu hari, ia memutuskan untuk jalan-jalan spontan seorang diri, tapi malah ketemu cowok bernama Kangon... yang langsung mengajak Hayun pacaran di hari pertama mereka bertemu! Hayun menolaknya, namun kemudian dia bertemu Kangon lagi di universitasnya. Bukan hanya itu, tiba-tiba muncul cowok lain lagi yang tertarik pada Hayun! Cowok manakah yang akan berhasil meraih cinta Hayun?",5,2024
It Wasn't Love at First Sight,7030,ROMANCE,IM,WEDNESDAY,Medium,61647,1767695,145044,HIATUS,"Seo Eunjae, cucu dari keluarga konglomerat yang dikenal sebagai anak baik-baik dengan jalan hidup yang baik pula harus dijodohkan dengan lelaki yang memiliki reputasi sebagai ""pembunuh"", Yoon Siwoo, karena sang sepupu yang mendorongnya ke dalam situasi itu.
Setelah dijalani, sepertinya Siwoo laki-laki yang baik? Apa reputasi dan rumor yang beredar itu salah? Atau... apa yang dilihat Eunjae yang salah?",5,2024
The Heir,7029,ACTION,"Dongwoo Han, Dohee Lee",TUESDAY,Medium,132794,3929081,359988,ONGOING,"Jin Taeha adalah penerus 'Cheongu', salah satu konglomerat terkemuka di Korea. Saat tengah berlayar dengan kapal pesiar bersama keluarganya, mereka diserang oleh teroris, dan hanya Jin Taeha yang berhasil selamat.

Setelah menyadari bahwa pembantaian tersebut bukan kecelakaan melainkan perebutan kekuasaan kerabatnya, Jin Taeha pun bergabung dengan mafia Italia, 'Keluarga Salerno', untuk mempersiapkan pembalasan dendamnya.

Tujuh belas tahun kemudian, Jin Taeha kembali ke Korea untuk menjalankan misi balas dendamnya.",5,2024
My Child Will Have a Different Father,7028,ROMANTIC FANTASY,"Team Chung-Yeon, TAPAHA, Paganjang",MONDAY,Short,188213,4711545,320691,ONGOING,"“Aku tidak akan percaya cinta di kehidupan kali ini.”

Hinael Flake, putri Kerajaan Salle, dibunuh oleh Cether Phil saat sedang hamil anak mereka. Beruntung, dia mendapatkan kesempatan kedua dan kembali ke masa dua tahun sebelum dia menikah dengan Cether.

Demi menghindari masa depan yang malang,
dia mengubah nasibnya dan memilih pria lain untuk menjadi suaminya. Pilihannya jatuh kepada Lutz Viant, pangeran kedua kekaisaran Tricas yang dikenal sebagai iblis perang.

“Di kehidupan kali ini, aku pasti akan melindungi anakku yang kumiliki dengan pria lain.”",5,2024
Who Did I Sleep With?,7027,ROMANCE,"hot mandarin, HAMJANG",SUNDAY,Short,35145,663811,31916,HIATUS,"3 tersangka, 1 pelaku. Siapa yang sebenarnya ada bersamaku semalam?!",5,2024
Back to Chanbi,7026,ROMANCE,jang sawhee,FRIDAY,Short,56377,968830,90010,ONGOING,"Kang Gyunoh menjalani kehidupan SMA-nya dengan berbunga-bunga. Pasalnya, Baek Chanbi yang adalah gadis tercantik di kelasnya, menunjukkan ketertarikan padanya. Walau keduanya belum mengungkapkan perasaan masing-masing, Gyunoh merasa puas dengan diam-diam menerima perhatian dari Chanbi.

Namun, siapa sangka Chanbi mengalami kecelakaan yang menyebabkan dirinya kehilangan ingatan selama setahun terakhir, termasuk soal perasaannya pada Gyunoh! Mampukah Gyunoh membuat Chanbi jatuh cinta padanya lagi? Atau perasaannya itu akan berakhir bertepuk sebelah tangan?

Tapi... apa benar mereka saling menyukai sejak awal?",5,2024
