title,title_id,genre,authors,weekdays,length,subscribers,views,likes,status,synopsis,rating,year
Boy-Friend's Rule,5501,ROMANCE,Do yoon,SATURDAY,Short,138582,6606979,785952,COMPLETED,"Jiwoon diam-diam naksir Jaeyi karena Jaeyi baik padanya. Jiwoon mengira cepat atau lambat, Jaeyi akan menyatakan cinta padanya! Tapi ternyata Jiwoon salah mengartikan kebaikan Jaeyi, ternyata Jaeyi naksir orang lain… 
Sementara Jaeyi kira Jiwoon naksir temannya yang tinggi, besar, dan pendiam: Seohyun!
Pertemanan dengan cowok memang harus ada aturannya biar tidak ada salah paham di antara pertemanan ini!",5,2023
Chronicles of the Demon Faction,5500,FANTASY,"FORCE STUDIO, codezero",THURSDAY,Long,162906,13119545,969735,ONGOING,"Chun Hajin, Sang Raja Pembunuh dari Aliansi Suci Kebenaran, melarikan diri untuk mendapatkan kebebasannya. Sayangnya, dia malah kehilangan nyawanya saat kebebasan ada tepat di depan matanya. Saat mengira dirinya akan mati, sayup-sayup ia mendengar ucapan ini:

“Jayalah kultus lblis! Selaksa setan tunduk di hadapanmu! Saya mengucapkan selamat atas kesembuhan tuan muda ketiga!”

Ternyata Chun Hajin bereinkarnasi menjadi Seoryang, Tuan Muda Ketiga di Markas Kultus Iblis Agung yang adalah Musuh Masyarakat Murim! Ikuti kisah Chun Hajin dalam menaklukkan Murim dengan tubuh barunya!",5,2023
Temui Aku Sepulang Kerja,5499,ROMANCE,"HamDude, Hanna Park, RoseBean",WEDNESDAY,Medium,73582,2532860,182049,ONGOING,"""Aku juga pernah memimpikan cinta yang sederhana.""

Jung Chaewon menjadi pengantin dari pria yang telah meninggal demi mendapatkan uang sebesar 200 juta. Hanya ada satu syarat, yaitu dia tidak boleh jatuh cinta dengan siapa pun selama 1000 hari.

Sayangnya, dia malah bertemu mantan pacarnya di hari 'pernikahan'-nya!
Ditambah lagi, mantan yang dulu hendak menikahinya itu kini menjadi bos di perusahaan baru tempat ia bekerja.

Inilah kisah seorang wanita yang berpura-pura sudah menikah dan pria yang ingin mengungkap rahasianya.
Pertarungan 'rahasia' mereka dimulai!",5,2023
Undercover at Chaebol High,5498,DRAMA,AJ,TUESDAY,Medium,1200541,65402404,4771993,HIATUS,"Lee Dakyung, anggota sebuh organisasi gelap, terlambat mengetahui kematian bos yang telah membesarkannya sedari ia kecil. Setelah tahu bahwa dalang di balik kematian bosnya adalah 'Presdir Lee' dari Sayeong Group, ia pun bertekad untuk balas dendam. Namun, mendekati Presdir Lee tidaklah mudah, sehingga Dakyung tak punya pilihan selain menggali informasi tentang putranya. Untuk melancarkan misinya, ia menyusup ke tempat putra dari Presdir Lee konon bersekolah, SMA prestisius berisi anak konglomerat...",5,2023
Life of a Quack Healer,5497,FANTASY,"Nayen, 14hoek, saesong-i",SUNDAY,Long,169384,9973697,1178492,ONGOING,"Kang Seunghyeon mendadak terbangun di dimensi lain dan mendapati dirinya telah menjadi seorang ‘HEALER?’. Lho, kok ada tanda tanyanya? Seunghyeon pun bingung… ia menjadi healer, namun tidak bisa melakukan heal! Dengan kemampuan tak biasanya, Seunghyeon hidup sebagai ‘healer ilegal’ dan menyembuhkan para penjelajah serta rakyat Azle yang membutuhkan, sembari mencari cara untuk kembali ke dimensi aslinya!",5,2023
Surviving the Game as a Barbarian,5496,FANTASY,"MIDNIGHT STUDIO, Han tae-su, Jung Yoon-kang",FRIDAY,Medium,60460,3023062,224133,HIATUS,"Lee Hansoo menyelesaikan Dungeon and Stone, game seru yang belum bisa diselesaikan siapa pun!
 Setelah memainkannya siang malam selama 9 tahun dan bisa memasuki ruangan bos, Hansoo malah memasuki game-nya dan menjadi karakter yang dipilihnya, seorang barbarian, bernama Bjorn Yandel.
Bisakah Hansoo bertahan di dunia baru yang telah dihadapinya selama 9 tahun dalam bentuk game itu?",5,2023
I Abdicate My Title of Empress,5495,ROMANTIC FANTASY,"galbi, Kim hee sung, Hanboyeon",THURSDAY,Long,326270,22540532,2030506,COMPLETED,"Adelaide Gottorf, yang kini menjadi permaisuri dari Kaisar Carl Ulrich Egmont, meninggalkan posisinya. Tak disangka, Adel meninggalkan Kaisar untuk Lionel Balder, Menteri Pertahanan Kekaisaran Egmont. Apakah perpisahan ini ada hubungannya dengan Lionel? Atau selir Kaisar, Diane, yang menjadi dalangnya?",5,2023
Killer Reborn,5494,ACTION,"lee yun kyun, Lee Je Hwan",TUESDAY,Medium,301638,18468775,1320777,ONGOING,"Bikwang, seorang pembunuh legendaris yang dibentuk oleh Biksu Yuhwa dari Kuil Hwaguksa terlahir kembali sebagai Kim Kyungsoo, seorang petugas polisi, setelah terbunuh di tangan Biksu. Ingin menghancurkan kuil pencipta pembunuh itu, Bikwang kini harus beraksi di balik tubuh seorang polisi. Bagaimana cara Bikwang melancarkan aksinya?",5,2023
Pacaran Zaman Now,5493,ROMANCE,Various Artists,"MONDAY, TUESDAY, WEDNESDAY, THURSDAY, FRIDAY, SATURDAY, SUNDAY",Short,50205,1903039,157084,COMPLETED,"Kompilasi kisah percintaan masa kini dari author webtoon terfavorit!

Mau tahu cara anak muda zaman sekarang pacaran?
Apa sih bedanya dari generasi sebelumnya?

Cari tahu di kompilasi webtoon yang satu ini ya!",5,2023
Meet Me in the Middle,5465,ROMANCE,"Yoon Kim, White Cho",TUESDAY,Medium,418232,15822524,1248065,ONGOING,"""Aku benar-benar bisa membuat semuanya jadi lebih menyenangkan!""
Suatu hari seorang pria muda misterius muncul di hadapan Yeorum, seorang wanita berusia 30 tahun yang menjalani hidup dengan membosankan.

Pria yang bernama Jisung itu terus mendekati Yeorum dengan lucunya. Tapi mereka kan bertemu melalui aplikasi dating dengan saling mengganti umur aslinya?! Sebenarnya apa yang diinginkan pria itu?!

Komedi romantis yang mendebarkan dari dua orang yang saling menipu!
",5,2023
Enough,5439,FANTASY,aohakka,FRIDAY,Short,32709,729783,64980,COMPLETED,"Lacie dan Ray terjebak dalam dunia perbatasan antara hidup-mati, dan mereka harus segera mencari kunci pintu keluar mereka. Dengan bantuan kelinci-kelinci yang mereka sayangi dan teman-teman baru yang mereka temui selama perjalanan, mereka menjadi lebih kuat. Kuat untuk menghadapi kehidupan yang sesungguhnya.",5,2023
REQUIEM: Recalling your Memories,5438,HORROR,JULY Webtoon Studio,THURSDAY,Short,68420,1722639,177428,COMPLETED,"Di tahun terakhir SMA, Yuaru dan keempat temannya harus menempati gedung utama lama yang telah selesai di renovasi. Di hari pertama, mereka mendengar rumor di daerah itu yang mengatakan ada sebuah telepon umum yang dapat mengabulkan permintaan. Siap atau tidak, sesuatu yang mengerikan telah menanti untuk diungkap. ",5,2023
A Not So Fairy Tale,5425,ROMANCE,HyoBin,MONDAY,Long,360335,12024661,1111833,ONGOING,"Cheon Moran, bidadari yang terperangkap di dunia manusia setelah membunuh penebang kayu, terlibat dalam kasus pembunuhan. Identitas aslinya ketahuan oleh Sa Jeha, detektif yang menangani kasus pembunuhan tersebut. Semakin dekat Cheon Moran dengan Sa Jeha, keberadaan jubah bidadari Cheon Moran semakin terkuak… Kisah ini tentang balas dendam, kebencian, dan cinta bidadari di abad ke-21 untuk mendapatkan kembali jubahnya.",5,2023
Juvenile Offender,5424,ACTION,"Jeongjongtaek, Man's story",SUNDAY,Short,183059,11620066,994357,COMPLETED,"Di Korea Selatan ada banyak hukum sampah. Para pelaku yang sudah membuat hidup Lee Yoonsung bak neraka tak ada yang mendapatkan konsekuensi karena hukum sialan dan status mereka yang masih di bawah umur itu. Setelah menjadi kuat, Lee Yoonsung memulai pembalasan dendamnya!",5,2023
Return of the Legendary Ranker,5423,FANTASY,"Team Potato scones6, youwoori",SATURDAY,Short,105425,4754821,311004,COMPLETED,"Suatu hari, game Apocalypse Dungeon, ‘Dream Side’ menjadi kenyataan! Kang Seojun, atau yang lebih dikenal dengan alias 'Kei', seorang pekerja paruh waktu yang sedang mengantarkan paket tiba-tiba terjebak di dalam lift! Notifikasi biru dari game muncul di hadapannya dan monster-monster itu menyerang! Sebagai seseorang yang pernah menjadi 1st Ranker di Dream Side, Kei terus memecahkan tutorial yang sulit dan menjadi yang terkuat!",5,2023
Menikah Saja Sendiri,5422,ROMANCE,"chicc, Miji",WEDNESDAY,Short,158041,6715928,441230,COMPLETED,"Tinggal 5 bulan lagi sampai pernikahan, tapi pengantin wanitanya belum ada?! Aku, Cheon Sooyeon, yang bekerja keras sebagai sekretaris presdir perusahaan, Tae Mujin, selama 4 tahun, harus mengurus pernikahannya, padahal aku telah menyukainya selama ini! Apa harus kurelakan cinta untuk presdir yang kucintai?",5,2023
The Perfect Hybrid,5416,FANTASY,"Clover, ZAINO, soulpung",FRIDAY,Long,102221,5871506,447545,HIATUS,"Yoo Gwangik, yang merupakan turunan campuran immortal dan pengubah bentuk, bercita-cita mengalahkan invader sambil menikmati kehidupannya! Bisakah ia melakukan itu sembari menjaga identitasnya sebagai turunan campuran sempurna dari semua orang?",5,2023
Beast's Flower,5415,ROMANTIC FANTASY,"Charles, Habrin, Hwang DoTol",MONDAY,Short,344206,15301655,1077836,COMPLETED,"Layla, yang sudah bau busuk sejak lahir, terpaksa tinggal sendiri di sebuah gubuk di tengah hutan. Pada suat hari, Viost yang 'tidak bisa mencium bau' menghampiri Layla di gubuknya. Untuk pertama kalinya, Layla diperlakukan dengan baik oleh seseorang. Lambat laun, Layla jatuh cinta padanya... tapi akankah cintanya itu membahayakan dirinya?",5,2023
Random Target,5414,ROMANCE,"Yuhan, INE",SATURDAY,Short,222926,10838256,936032,COMPLETED,"Sebagai pecinta pria tampan, Choi Serin selalu mencari pria idaman yang sempurna. Sayangnya kisah percintaannya tidak berjalan mulus,dan bahkan ia diputuskan oleh pacarnya seminggu sebelum hari ulang tahunnya. Untuk melupakan penderitaannya, Serin akhirnya memutuskan untuk melakukan kencan buta secara virtual melalui Random Target! Dan di sana, ia bertemu dengan... unicorn?!",5,2023
My Lucky Strike,5413,ROMANCE,bakSSdam,MONDAY,Medium,321360,14149407,1546649,ONGOING,"Kehidupan perkuliahan Gong Siru mendadak kacau karena dua pria dan suatu ‘insiden’. Saat mabuk berat setelah minum-minum dengan teman sejurusannya… Gong Siru mencium seorang lelaki! Keesokan harinya, Gong Siru terbangun dengan luka pada bibirnya dan ingatan yang tak jelas. Siapakah pria yang ia cium malam itu? Apakah Seol Gibaek, senior tampan yang bersahabat dengannya? Ataukah Jo Cheong, teman angkatannya yang cool dan jadi pujaan wanita? ",5,2023
Kembalinya Iblis ke Sekolah,5412,ACTION,"Siwon, Team the JICK, San Cheon",SATURDAY,Medium,401905,20697104,1279063,COMPLETED,"Di hari terakhirku saat  berusia 19 tahun, aku dibunuh oleh pelaku kekerasan sekolah. Kini aku kembali ke masa lalu dan memutuskan untuk menjadi kejahatan yang memusnahkan kejahatan!",5,2023
The Father Returns,5408,ROMANTIC FANTASY,"Sanbom, haeyeoneul",THURSDAY,Medium,309783,13629824,1134718,ONGOING,"Claire yang memiliki kekuatan sejak kecil merasa berbeda dari anak seumurannya. Dia pun terus mempertanyakan kenapa dia harus terus kabur dan bersembunyi bersama saudara kembar dan ibunya. 
Tapi suatu hari, orang yang mengaku sebagai ayahnya muncul di hadapan mereka dan Claire pun perlahan mengetahui rahasia keluarganya!",5,2023
Hello Baby,5367,ROMANCE,ENJELICIOUS,SUNDAY,Medium,311413,15032499,1128760,HIATUS,"Gwen dan Arthur, sejoli yang bertemu saat liburan di kapal pesiar kini mempunyai seorang anak laki-laki. Namun, hubungan mereka sangatlah rumit. Pengadilan dan seorang nenek sampai terlibat, sebenarnya apa yang terjadi?",5,2023
Boundless Ascension,5366,FANTASY,"2love(REDICE STUDIO), SHYATAN (REDICE STUDIO), Fleecy cloud",SATURDAY,Long,111246,7416332,423903,ONGOING,"Ini sudah 7 tahun... Tapi kenapa Han Sungyoon, masih saja seorang calon hunter? Di saat semua orang bisa menjadi hunter hanya dalam kurun waktu beberapa bulan, hal yang berbeda terjadi padanya. Tiba-tiba masuk ke dalam menara ujian, apakah ini awal perubahan jalan Sungyoon?",5,2023
Grup Chat Tanpa Aku,5365,DRAMA,Bongsoo,THURSDAY,Short,93626,3910705,464835,COMPLETED,"Ahn Hyoin, seorang siswi yang akhirnya mendapatkan smartphone pribadinya di antara teman-temannya. Tak disangka, hanya dia yang tak dimasukkan ke grup chat kelasnya. Mengetahui hal itu, Hyoin turun tangan. Bagaimana caranya menghadapi permasalahan soal grup chat ini?",5,2023
The Constellations Are My Disciples,5364,FANTASY,"INUS, Cha jiwoon, Bangguseok Gimssi",MONDAY,Long,169569,11097576,774985,HIATUS,"Kim Hyunoh yang sudah mengalahkan menara kehancuran, seharusnya bisa menikmati hidup tenangnya dan kekayaannya. Tapi ternyata dia meninggal dan saat terbangun dia sudah ada di 300 tahun kemudian di tubuh Kim Joohyuk.
Dan lebih parahnya lagi, dia jadi orang biasa sementara semua muridnya jadi Konstelasi dari keluarga ternama di Korea!",3.45,2023
Iblis di Antara Kita,5363,THRILLER,Nemo Nullus,FRIDAY,Long,251764,15690120,1329919,ONGOING,"Ada saja hal tak terduga yang terjadi di dunia ini, termasuk aksi dari insting orang-orang di sekitar kita. Bagaimana jadinya jika perbuatan kita membuat orang lain melakukan hal-hal yang ekstrem bak iblis sebagai balasannya? Hati-hati, karena iblis ada di antara kita! (Content Warning: Memicu Trauma)",5,2023
The Strongest Outcast,5362,ACTION,team ggulbal,WEDNESDAY,Long,167610,9617713,549518,ONGOING,"Cha Mugyeol yang selalu jadi anak buangan dan selalu dirundung, tiba-tiba tubuhnya dimasukin jiwa Cha Mugyeol yang seorang atlet MMA yang meninggal beberapa waktu lalu karena ketidakadilan yang dialaminya. Suatu kebetulan mereka memiliki nama yang sama.
Untuk membalaskan dendam, dia pun memutuskan untuk menjadi petarung sejati!",5,2023
Unquenchable Thirst,5361,ROMANCE,"Bagatel/EYE, INO, Hanyoung Hwang",SATURDAY,Short,104425,2712825,126218,COMPLETED,"Sebagai tulang punggung keluarga dan karyawan kontrak di sebuah perusahaan yang harus menghadapi kolega-kolega toksik, hidup Yeonji Nam sudah teramat sulit. Namun pada suatu hari perusahaan tersebut kedatangan wakil direktur baru, Joonwon Do, pria yang juga melakukan hubungan satu malam dengannya enam tahun yang lalu! Anehnya, malam yang ingin dilupakan Yeonji tersebut tak hentinya disebut-sebut oleh Joonwon, dan Joonwon pun memindahtugaskan Yeonji menjadi sekretarisnya. Sebenarnya apa yang Joonwon inginkan? ",5,2023
The Villainess Behind the Mask,5360,ROMANTIC FANTASY,"SAN, Seogac, Leeha Seo",THURSDAY,Short,123242,3225822,259601,COMPLETED,"Winsty Sol yang ditipu dan dibunuh oleh Adelina, sepupunya sendiri, di hari pernikahannya kembali untuk membalas dendam!

Di kehidupan keduanya ini, Winsty bekerja sama dengan Duke Legef Crander untuk menggagalkan rencana jahat Adelina. Bagaimana perjuangan Winsty dalam merebut kembali posisi kepala keluarga dan mengembalikan kejayaan Keluarga Sol?",2.8,2023
Love and Wifi in the Palace,5359,ROMANTIC FANTASY,"Joa, Ginyu",WEDNESDAY,Short,80174,3273037,337335,COMPLETED,"Sohyang, selir raja dari zaman Joseon, dan Taepung, penulis webtoon yang memerlukan ide cerita untuk karya berikutnya, terpisah waktu 200 tahun namun terhubung karena sebuah lemari kuno. Taepung membantu Sohyang merayu raja, dan kehidupan Sohyang menjadi inspirasi bagi karya Taepung. Bagaimana hubungan yang terpisah waktu ini akan terjalin? ",2.55,2023
Sang Bayi Tiran,5358,ROMANTIC FANTASY,"Awon, Lee Huin",TUESDAY,Long,834258,58404125,5047160,ONGOING,"Hidup Yoon Gyeoul yang penuh penderitaan akibat orangtuanya berubah 180 derajat setelah dia terlahir kembali sebagai Maybell, putri dari Kaisar Ermanno. Tak hanya memiliki ayah dan kakak yang sangat menyayanginya, dia juga dipercaya menjadi bibit yang akan menyelamatkan dunia! Apakah kesempatan hidup kedua ini bisa mengubah pandangan Gyeoul soal keluarga?",5,2023
Who Stole the Empress?,5357,ROMANTIC FANTASY,"Muhly, Pinku, Lee jihye",TUESDAY,Short,502973,28475267,2085860,COMPLETED,"Tak lagi punya alasan untuk hidup setelah dituduh berkhianat dan orang-orang terdekatnya dihabisi suaminya sendiri, Roselyn V. Sunset, sang ratu kekaisaran Thanatos, menyambut kematiannya dengan sukarela saat diasingkan ke padang salju. Di hamparan salju putih yang dingin itulah Roselyn menunggu ajal menjemput, tanpa ada lagi semangat maupun ambisi untuk terus hidup… sampai ia ditemukan oleh Tamon Krasis, diplomat dari Amor. ",3,2023
For The Third Time,5356,ROMANCE,"NARA, Got W",MONDAY,Medium,213092,10830152,761402,COMPLETED,"Fenomena time loop atau mengulang kembali waktu yang dialami Baek Dohee memastikan kesuksesannya dalam berkarir, namun karena itu pula ia enggan memulai hubungan percintaan. Di umurnya yang mendekati kepala tiga, Baek Dohee pikir hidupnya akan begitu-begitu saja, terjebak di dalam time loop untuk selamanya—sampai pada suatu saat Dohee bertemu dengan Seo Junwon, yang mengaku bahwa ia juga mengalami time loop! 

(Content Warning: Unsur Dewasa)",3.5,2023
Situationship,5355,ROMANCE,yeo eun,WEDNESDAY,Short,162977,6328604,434190,ONGOING,"Jung Yoonjae, wanita berusia 30-an ini lelah dengan hubungan asmara ala pasangan usia 20-an. Dia tak ingin berpacaran karena kehidupannya yang sibuk dan hubungan yang umumnya membuat sakit kepala. Sampai suatu hari, Kim Minseok datang ke kehidupannya dan menunjukkan sisi hubungan yang baru dan sejalan dengan yang diinginkannya. Bagaimana hubungan keduanya akan terjalin?",3.35,2023
The Problematic Prince,5349,ROMANTIC FANTASY,"CACTUS, Solche",SATURDAY,Long,486368,31619894,2432887,ONGOING,"Erna Hardy, seorang gadis polos yang nekat pergi ke ibukota demi mempertahankan tempat tinggalnya bersama Sang Nenek, tanpa sengaja bersinggungan dengan Bjorn Denyster, seorang mantan Putra Mahkota yang dijuluki 'jamur beracun'. Takdir terus mengikat keduanya dalam suatu hubungan yang 'problematik'. Siapakah yang akan menyerah dan luluh dengan perasaannya terlebih dahulu?",3.2,2023
The Tyrant Wants to Be Good,5327,ROMANTIC FANTASY,"KAKON, Ramguel",SUNDAY,Long,677143,40732841,3417057,ONGOING,"Sedari kecil, Dorothea Millanaire tak pernah merasakan kasih sayang dan diperlakukan dengan buruk. Tak terima dengan nasibnya, ia membunuh kakaknya dan merampas takhta kekaisaran. Dengan segala kekejaman dan kehancuran yang ia bawa saat memegang kuasa, Dorothy dijuluki seorang tiran dan pada akhirnya dihukum mati oleh rakyatnya. Namun saat membuka mata, Dorothy kembali ke masa kecilnya! Pada kesempatan kali ini, Dorothy bertekad untuk mengubah masa depannya dan menjadi orang baik. Akankah Dorothy berhasil?",3.65,2023
Black Knight,5326,FANTASY,lee yun kyun,FRIDAY,Medium,116443,3303425,281029,COMPLETED,"Di dunia masa depan yang telah hancur dan rusak akibat polusi udara, keberlangsungan hidup manusia kini ada di tangan para kurir pengantar barang Black Knight, dan mereka bukan kurir pengantar barang biasa. Webtoon dari drama Black Knight!",5,2023
Returned as the Duke,5325,FANTASY,"Choi Bong-geun (AKEO Studio), Lee Ha Zoo, Highland",THURSDAY,Long,97808,4525075,372525,COMPLETED,"Brahn, wilayah tak penting di pinggiran Imperium dihancurkan oleh Kaisar dan tentaranya. Seorang sekretaris tua tidak berguna yang seharusnya ikut mati dalam peristiwa tersebut, malah hidup kembali sebagai “duke” Brahn di masa mudanya, 20 tahun yang lalu. Setelah melewati kebingungan akan nasibnya, ia bertekad untuk menghargai kesempatan kedua yang telah diberikan dengan memimpin wilayah Brahn hingga menjadi wilayah yang sejahtera, dan mencegah kehancuran di tangan Kaisar Zeron. Akankah perjuangannya berhasil?",3.05,2023
Privately,5309,DRAMA,omenilno,FRIDAY,Medium,128115,6190687,792570,ONGOING,"Menceritakan Naka dan Islan, suami istri cemara yang menavigasi hidupnya melalui pertemuan dengan tetangga-tetangga aneh yang menyembunyikan rahasia busuk dari masa lalu. Baunya mulai menguar ke permukaan dan mungkin mereka dalam bahaya.",5,2023
I Thought My Time Was Up!,5308,ROMANTIC FANTASY,"Essie, Hyeyong, Ari Choi",SATURDAY,Medium,763915,45562099,3585638,ONGOING,"Lariette Blanchett divonis hanya punya sisa waktu 3 bulan untuk hidup. Dia pun memutuskan untuk melakukan hal-hal yang dia inginkan sebelum meninggal dunia, termasuk memutuskan pertunangannya dan memulai hubungan kontrak selama 3 bulan dengan Asrahan Candel, seorang duke yang dijuluki monster. Namun, ternyata vonis tersebut merupakan kesalahan diagnosis! Mampukah Lariette 'kabur' dari kejaran Asrahan?",3.5,2023
Assassin's Creed: Forgotten Temple,5307,FANTASY,"Tabii, ARC, SHYATAN",MONDAY,Long,53102,1748157,123259,ONGOING,Edward Kenway kembali bertualang di laut untuk mencari harta karun hilang yang diincar oleh berbagai pihak! Bergabunglah dalam perjalanan epik Edward mengelilingi Laut Cina. Baca Assassin's Creed: Forgotten Temple hanya di WEBTOON.,2.95,2023
I Became the Tyrant of a Defense Game,5297,FANTASY,"Gyong, Ha Jung, RyuMo",SATURDAY,Long,121231,7199672,670448,HIATUS,"Classical Geek, user dari classic defense game Protect the Empire berhasil menuntaskan game yang belum  pernah diselesaikan siapa pun selama 10 tahun.
Pencipta game tersebut menghubunginya, tapi... Kenapa dia malah harus berjuang dalam game itu lagi?",3.9,2023
Absolute Sword Sense,5295,ACTION,"TI, KDRM, HANJUNG WOLYA",FRIDAY,Long,75725,6284006,468300,ONGOING,"Setelah diculik oleh sekte Darah dan hidup sebagai mata-mata, lalu mati oleh atasannya sendiri.
Di kehidupan kali ini Woonhwi memutuskan akan mengubah masa lalunya yang menyedihkan!",3.8,2023
Is Romance Possible?,5294,ROMANCE,"Im Jooyi, SONG Jeongwon",SUNDAY,Short,239640,9769051,816624,COMPLETED,"Setelah hidup selama 24 tahun, Seo Yida seorang gadis tomboy yang selama ini tinggal di panti asuhan, baru mengetahui dia mempunyai kembaran yang diangkat oleh keluarga konglomerat bernama Choi Hyeju. Seo Yida diminta untuk menggantikan Choi Hyeju yang kabur dari rumah untuk menikahi Kang Chanjae selama 1 tahun. Tidak masalah, asal Seo Yida mendapatkan uang muka sebesar 500 juta won dan ditambah 500 juta won lagi nantinya! Total adalah 1 milyar won!",5,2023
Couple Breaker,5287,ROMANCE,"KMK, Taegeon",TUESDAY,Short,508989,26239678,2680345,COMPLETED,"PERANG ANTAR PASANGAN DIMULAI! Gara-gara dating show ‘The Couple Breaker’, kehidupan dan hubungan cinta dua pasang kekasih muda terbelit satu sama lain. Setelah diselingkuhi pacar masing-masing, Yang Taerin dan Bong Yoonshik bertekad untuk balas dendam bersama-sama dengan menghancurkan impian para mantan, Chu Kyungmo dan Gong Jooah. Akankah balas dendam mereka berhasil? Atau adakah bibit-bibit cinta yang akan muncul di antara keduanya? Saksikan kisah balas dendam penuh emosi hasil kolaborasi penulis ‘Her Secret’ dan ‘Sisters at war’ dengan ilustrator ‘To Love Your Enemy’!",3.75,2023
Mr. Baek,5286,ACTION,"Punch Kick, Haetae",MONDAY,Long,426121,27289188,1805532,ONGOING,"Baek Yisoo, anggota intelijen yang menjalani kehidupan bersimbah darah kehilangan seluruh anggotanya karena operasi black out yang tiba-tiba terjadi saat dirinya menemui sang kakak, Baek Dokyung.
Tak lama sejak itu, Dokyung juga ""tewas"" karena penyerangan saat pencarian keberadaan Yisoo. Apa rencana Yisoo setelah semua orang berharganya terenggut?",3.5,2023
The Dragon King's Bride,5285,ROMANTIC FANTASY,"SOY MEDIA, Kanghee Jamae",SATURDAY,Short,506123,32120697,2326163,COMPLETED,"Lucina, anak gelap dari Kerajaan Brion yang memiliki kekuatan penyembuhan bertemu dengan Hakkan, seekor naga dari Suku Tayar, yang sekarat. Siapa sangka, mereka bertemu lagi saat sang naga berniat untuk membantai masyarakat Brion.
Tapi saat ingin melakukan pembantaian, Hakkan justru menikahi Lucina! Apa yang akan terjadi setelah pernikahan itu?",3.15,2023
Bloodhounds,5284,ACTION,Jeong Chan,WEDNESDAY,Medium,107254,2985432,195143,COMPLETED,"Di dunia ini hanya ada dua golongan: orang yang kehilangan dan orang yang merampas. Karena ibunya terjerat utang, Gunwoo hidup sebagai orang yang merampas. Ia menjadi seorang 'anjing pemburu' di bawah Choi Hwan, sosok misterius yang memiliki pengaruh luas. Ikuti kisah Gunwoo yang kini harus hidup dan bekerja menjadi rentenir!",2.8,2023
Her Twin Brothers!,5282,SLICE OF LIFE,aizonoodle,"WEDNESDAY, SUNDAY",Medium,147889,5712639,741454,COMPLETED,Ketika sebuah kisah cinta terhalang oleh keberadaan kedua kakak kembar bermasalah yang selalu meneror kehidupan percintaan mereka,3.15,2023
Fighter,5281,ACTION,"JUN SANG YOUNG, DAYWALKER",THURSDAY,Short,46629,1130869,50544,COMPLETED,"Sebagai anak tunggal dengan ibu yang sakit-sakitan, Woo Bongjun bertahan hidup dengan membuka sebuah rumah makan di distrik Nodab. Namun, suatu hari rumah makannya hendak dibongkar dan dijadikan 'area bertarung' oleh konstruksi Pungrak! Bongjun pun berusaha menghentikannya dengan mengerahkan seluruh kemampuan bertarungnya, tetapi saat ia hampir kehilangan harapan, bos grup pungrak mengusulkan pertarungan 1 lawan 1 dengan petarung profesional. Mampukah Bongjun menyelamatkan rumah makan sekaligus kehidupan keluarganya?",2.2,2023
My Husband Changes Every Night,5245,ROMANTIC FANTASY,"Yeoseulki, koo seul, Han Yoon Seol",FRIDAY,Short,353721,14721842,1268398,COMPLETED,"Terriella, yang mempunyai kekuatan suci dikirim oleh keluarganya untuk menjadi pendamping Raja Rivanfell Pon Leonhardt yang terkenal seorang tiran. Tak disangka, ternyata Rivanfell adalah korban percobaan yang dilakukan untuk menyelamatkan dunia dari datangnya hari kiamat yang membuat dirinya berubah tiap tengah malam datang. 

Kekuatan suci Terriella bisa mengubah Rivanfell kembali ke wujud semula, tapi apakah kekuatan itu bisa membuatnya terbebas untuk selamanya?",3.25,2023
When We Were Fifteen,5243,SLICE OF LIFE,Hanin Naqib,"MONDAY, FRIDAY",Medium,132559,4876588,715386,COMPLETED,"Tahun pertama di SMA! Nana yang kesulitan berteman, bertemu dengan kawan-kawan barunya di sekolah. Seketika, hari-hari Nana yang sepi diisi dengan kisah persahabatan yang manis sekaligus rumit.",3.05,2023
Secretary's Escape,5242,ROMANCE,"HoneyBong, Solbangul, Banjiyoung",FRIDAY,Short,388119,23839170,1628648,COMPLETED,"Mengikuti jejak kedua orang tuanya, semenjak SMA Chu Iyeon bekerja untuk keluarga pemilik Jaekyung Group sebagai tutor putra dari selir, Lee Munjo. Ketika dewasa, Iyeon bekerja menjadi sekretaris sang putra pewaris utama Lee Seungjo yang diam-diam dia sukai sejak remaja. Iyeon ingin menyelidiki kematian misterius sang mantan presdir yang disebut disebabkan oleh ayahnya, sehingga terus bertahan di Jaekyung Group meski menderita. Apalagi, Lee Seungjo yang dia idamkan tiba-tiba menciumnya....",5,2023
